<?xml version="1.0" encoding="UTF-8"?>
<!DOCTYPE language SYSTEM "language.dtd">
<language name="HTML" section="Markup" extensions="*.html;*.htm;*.shtml;*.shtm" mimetype="text/html">
  <highlighting>
    <contexts>
       <context attribute="0" lineEndContext="0">
         <RegExpr attribute="1" context="1" String="&lt;\s*\/?\s*[a-zA-Z0-9_]*" />
       </context>

       <context attribute="2" lineEndContext="1">
         <DetectChar attribute="1" context="0" char="&gt;"/>
         <RegExpr attribute="0" context="2" String="\s*=\s*"/>
       </context>

       <context attribute="8" lineEndContext="2">
         <RegExpr attribute="3" context="1" String="\s*#?[a-zA-Z0-9]*" />
         <DetectChar attribute="3" context="3" char="&quot;" />
       </context>

       <context attribute="3" lineEndContext="3">
         <DetectChar attribute="3" context="1" char="&quot;" />
       </context>

       <context attribute="5" lineEndContext="0"/>
       <context attribute="4" lineEndContext="0">
         <DetectChar attribute="4" context="0" char="'"/>
       </context>
    </contexts>
    <itemDatas>
      <itemData name="Normal Text" defStyleNum="dsNormal"/>
      <itemData name="Keyword" defStyleNum="dsKeyword"/>
      <itemData name="Identifier" defStyleNum="dsOthers"/>
      <itemData name="Types" defStyleNum="dsDataType"/>
      <itemData name="String" defStyleNum="dsString"/>
      <itemData name="Comment" defStyleNum="dsComment"/>
    </itemDatas>
  </highlighting>
  <general>
    <comments>
      <comment name="multiLine" start="&lt;!--" end="//--&gt;" />
    </comments>
    <keywords casesensitive="0" />
  </general>
</language>
