<?xml version="1.0" encoding="UTF-8"?>
<!DOCTYPE language SYSTEM "language.dtd">
<language name="XML/SGML" section="Markup" extensions="*.docbook;*.xml;*.rc;*.sgml" mimetype="text/sgml;text/xml;text/book">
  <highlighting>
    <contexts>
       <context attribute="0" lineEndContext="0">
         <RegExpr attribute="1" context="1" String="&lt;\s*\/?\s*[a-zA-Z_:][a-zA-Z0-9._:-]*" />
       </context>

       <context attribute="2" lineEndContext="1">
		 <Detect2Chars attribute="1" context="0" char="/" char1="&gt;" />
		 <DetectChar attribute="1" context="0" char="&gt;" />
         <RegExpr attribute="0" context="2" String="\s*=\s*" />
       </context>

       <context attribute="3" lineEndContext="2">
		 <RegExpr attribute="3" context="1" String="[A-Za-z0-9.-]*" />
         <DetectChar attribute="3" context="3" char="&quot;" />
       </context>

       <context attribute="3" lineEndContext="3">
         <DetectChar attribute="3" context="1" char="&quot;" />
       </context>

    </contexts>
    <itemDatas>
      <itemData name="Normal Text" defStyleNum="dsNormal"/>
      <itemData name="Keyword" defStyleNum="dsKeyword"/>
      <itemData name="Identifier" defStyleNum="dsOthers"/>
      <itemData name="Types" defStyleNum="dsDataType"/>
      <itemData name="String" defStyleNum="dsString"/>
      <itemData name="Comment" defStyleNum="dsComment"/>
    </itemDatas>
  </highlighting>
  <general>
    <comments>
      <comment name="multiLine" start="&lt;!--" end="//--&gt;" />
    </comments>
    <keywords casesensitive="0" />
  </general>
</language>
