<?xml version="1.0" encoding="UTF-8"?>
<!DOCTYPE language SYSTEM "language.dtd">
<language name="Java" section="Sources" extensions="*.java" mimetype="text/x-java-src">
  <highlighting>
    <list name="keywords">
      <item> abstract </item>
      <item> break </item>
      <item> case </item>
      <item> catch </item>
      <item> class </item>
      <item> continue </item>
      <item> default </item>
      <item> do </item>
      <item> else </item>
      <item> extends </item>
      <item> false </item>
      <item> finally </item>
      <item> for </item>
      <item> goto </item>
      <item> if </item>
      <item> implements </item>
      <item> import </item>
      <item> instanceof </item>
      <item> interface </item>
      <item> native </item>
      <item> new </item>
      <item> null </item>
      <item> package </item>
      <item> private </item>
      <item> protected </item>
      <item> public </item>
      <item> return </item>
      <item> super </item>
      <item> strictfp </item>
      <item> switch </item>
      <item> synchronized </item>
      <item> this </item>
      <item> throws </item>
      <item> throw </item>
      <item> transient </item>
      <item> true </item>
      <item> try </item>
      <item> volatile </item>
      <item> while </item>
    </list>
    <list name="types">
      <item> boolean </item>
      <item> byte </item>
      <item> char </item>
      <item> const </item>
      <item> double </item>
      <item> final </item>
      <item> float </item>
      <item> int </item>
      <item> long </item>
      <item> short </item>
      <item> static </item>
      <item> void </item>
    </list>
    <contexts>
      <context attribute="0" lineEndContext="0" name="Normal">
        <keyword attribute="1" context="0" String="keywords"/>
        <keyword attribute="2" context="0" String="types" />
        <Float attribute="6" context="0">
          <AnyChar String="fF" attribute="6" context="0"/>
        </Float>
        <HlCOct attribute="4" context="0"/>
        <HlCHex attribute="5" context="0"/>
        <Int attribute="3" context="0" >
          <StringDetect attribute="3" context="0" String="ULL" insensitive="TRUE"/>
          <StringDetect attribute="3" context="0" String="LUL" insensitive="TRUE"/>
          <StringDetect attribute="3" context="0" String="LLU" insensitive="TRUE"/>
          <StringDetect attribute="3" context="0" String="UL" insensitive="TRUE"/>
          <StringDetect attribute="3" context="0" String="LU" insensitive="TRUE"/>
          <StringDetect attribute="3" context="0" String="LL" insensitive="TRUE"/>
          <StringDetect attribute="3" context="0" String="U" insensitive="TRUE"/>
          <StringDetect attribute="3" context="0" String="L" insensitive="TRUE"/>
        </Int>
        <HlCChar attribute="7" context="0"/>
        <DetectChar attribute="8" context="1" char="&quot;"/>
        <Detect2Chars attribute="10" context="2" char="/" char1="/"/>
        <Detect2Chars attribute="10" context="3" char="/" char1="*"/>
        <AnyChar attribute="11" context="0" String="!%&amp;()+,-&lt;=&gt;?[]^{|}~"/>
      </context>
      <context attribute="8" lineEndContext="0" name="String">
        <LineContinue attribute="8" context="0"/>
        <HlCStringChar attribute="9" context="1"/>
        <DetectChar attribute="8" context="0" char="&quot;"/>
      </context>
      <context attribute="10" lineEndContext="0" name="Commentar 1"/>
      <context attribute="10" lineEndContext="3" name="Commentar 2">
        <Detect2Chars attribute="10" context="0" char="*" char1="/"/>
      </context>
    </contexts>
    <itemDatas>
      <itemData name="Normal Text" defStyleNum="dsNormal"/>
      <itemData name="Keyword"  defStyleNum="dsKeyword"/>
      <itemData name="Data Type"  defStyleNum="dsDataType"/>
      <itemData name="Decimal"  defStyleNum="dsDecVal"/>
      <itemData name="Octal"  defStyleNum="dsBaseN"/>
      <itemData name="Hex"  defStyleNum="dsBaseN"/>
      <itemData name="Float"  defStyleNum="dsFloat"/>
      <itemData name="Char"  defStyleNum="dsChar"/>
      <itemData name="String"  defStyleNum="dsString"/>
      <itemData name="String Char"  defStyleNum="dsChar"/>
      <itemData name="Comment"  defStyleNum="dsComment"/>
      <itemData name="Symbol"  defStyleNum="dsNormal"/>
    </itemDatas>
  </highlighting>
  <general>
    <comments>
      <comment name="singleLine" start="//" />
      <comment name="multiLine" start="/*" end="*/" />
    </comments>
    <keywords casesensitive="1" />
  </general>
</language>
