<?xml version="1.0" encoding="UTF-8"?>
<!DOCTYPE language SYSTEM "language.dtd">
<language name="Perl" section="Scripts" extensions="*.pl;*.pm" mimetype="">
<highlighting>
	<list name="keywords">
		<item> sub </item>
		<item> bless </item>
		<item> caller </item>
		<item> cmp </item>
		<item> print </item>
		<item> echo </item>
		<item> die </item>
		<item> import </item>
		<item> lt </item>
		<item> le </item>
		<item> local </item>
		<item> last </item>
		<item> ! </item>
		<item> || </item>
		<item> eq </item>
		<item> ne </item>
		<item> use </item>
		<item> elsif </item>
		<item> my </item>
		<item> foreach </item>
		<item> wantarray </item>
		<item> push </item>
		<item> pop </item>
		<item> dbmclose </item>
		<item> dbmopen </item>
		<item> dump </item>
		<item> each </item>
		<item> ge </item>
		<item> gt </item>
		<item> split </item>
		<item> open </item>
		<item> close </item>
		<item> eval </item>
		<item> chomp </item>
		<item> chop </item>
		<item> unless </item>
		<item> undef </item>
		<item> next </item>
		<item> unlink </item>
		<item> new </item>
		<item> and </item>
		<item> not </item>
		<item> no </item>
		<item> ref </item>
		<item> redo </item>
		<item> require </item>
		<item> tied </item>
		<item> tie </item>
		<item> untie </item>
		<item> or </item>
		<item> xor </item>
		<item> continue </item>
		<item> do </item>
		<item> else </item>
		<item> for </item>
		<item> goto </item>
		<item> if </item>
		<item> return </item>
		<item> switch </item>
		<item> while </item>
	</list>

	<contexts>

		<context attribute="0" lineEndContext="0" name="Normal">
			<keyword attribute="1" context="0" String="keywords"/>
			<keyword attribute="2" context="0" String="types"/>
			<HlCOct attribute="4" context="0"/>
			<HlCHex attribute="5" context="0"/>
			<Int attribute="3" context="0" />
			<HlCChar attribute="7" context="0"/>
			<RegExpr attribute="1" context="0" String="^#!.*" />
			<DetectChar attribute="8" context="1" char="&quot;"/>
			<DetectChar attribute="8" context="12" char="'"/>
			<DetectChar attribute="9" context="1" char="`"/>
			<Detect2Chars attribute="10" context="2" char="/" char1="/"/>
			<Detect2Chars attribute="10" context="3" char="/" char1="*"/>
			<Detect2Chars attribute="12" context="9" char="s" char1="/" />
			<DetectChar attribute="12" context="8" char="/" />
			<AnyChar attribute="11" context="0" String="!%&amp;()+,-&lt;=&gt;?[]^{|}~"/>
			<RegExpr attribute="3" context="0" String="\$[0-9]+" />
			<RegExpr attribute="2" context="0" String="\$\#?[a-zA-Z_]+[a-zA-Z0-9_]*" />
			<RegExpr attribute="12" context="0" String="\s+\:" />
			<DetectChar attribute="10" context="2" char="#" />
		</context>

		<context attribute="8" lineEndContext="1" name="String">
			<LineContinue attribute="8" context="6"/>
			<HlCStringChar attribute="9" context="1"/>
			<DetectChar attribute="8" context="0" char="&quot;"/>
			<RegExpr attribute="3" context="1" String="\$[0-9]+" />
			<RegExpr attribute="2" context="1" String="\$[a-zA-Z_]*[a-zA-Z0-9_]*" />
		</context>

		<context attribute="10" lineEndContext="0" name="Commentar 1"/>

		<context attribute="10" lineEndContext="3" name="Commentar 2">
			<Detect2Chars attribute="10" context="0" char="*" char1="/"/>
		</context>

		<context attribute="12" lineEndContext="0" name="Preprocessor">
			<LineContinue attribute="12" context="7"/>
			<RangeDetect attribute="13" context="4" char="&quot;" char1="&quot;"/>
			<RangeDetect attribute="13" context="4" char="&lt;" char1="&gt;"/>
			<Detect2Chars attribute="10" context="2" char="/" char1="/"/>
			<Detect2Chars attribute="10" context="5" char="/" char1="*"/>
		</context>

		<context attribute="10" lineEndContext="5" name="Commentar/Preprocessor">
			<Detect2Chars attribute="10" context="4" char="*" char1="/" />
		</context>

		<context attribute="0" lineEndContext="1" name="Some Context"/>

		<context attribute="0" lineEndContext="4" name="Some Context2"/>

		<context attribute="12" lineEndContext="8" >
			<RegExpr attribute="9" context="8" String="\\[\/\[\]dDwWsSnrtfb0\$@]?" />
			<RegExpr attribute="9" context="8" String="\^[\/\[\]]?" />
			<DetectChar attribute="12" context="0" char="/" />
		</context>

		<context attribute="12" lineEndContext="9">
			<RegExpr attribute="9" context="9" String="\\[\/\[\]dDwWsSnrtfb0\$@]?" />
			<RegExpr attribute="9" context="9" String="\^[\/\[\]]?" />
			<RegExpr attribute="12" context="10" String="\/" />
		</context>

		<context attribute="12" lineEndContext="10">
			<RegExpr attribute="9" context="10" String="\\[\/\[\]dDwWsSnrtfb0\$@]?" />
			<RegExpr attribute="9" context="10" String="\^[\/\[\]]?" />
			<RegExpr attribute="12" context="0" String="\/g?" />
		</context>

		<context attribute="9" lineEndContext="11">
			<DetectChar attribute="9" context="0" char="`"/>
		</context>

		<context attribute="8" lineEndContext="1" name="String2">
			<LineContinue attribute="8" context="6"/>
			<Detect2Chars attribute="9" context="12" char="\" char1="'"/>
			<DetectChar attribute="8" context="0" char="'"/>
		</context>
	</contexts>

	<itemDatas>
		<itemData name="Normal Text" defStyleNum="dsNormal"/>
		<itemData name="Keyword"  defStyleNum="dsKeyword"/>
		<itemData name="Data Type"  defStyleNum="dsDataType"/>
		<itemData name="Decimal"  defStyleNum="dsDecVal"/>
		<itemData name="Octal"  defStyleNum="dsBaseN"/>
		<itemData name="Hex"  defStyleNum="dsBaseN"/>
		<itemData name="Float"  defStyleNum="dsFloat"/>
		<itemData name="Char"  defStyleNum="dsChar"/>
		<itemData name="String"  defStyleNum="dsString"/>
		<itemData name="String Char"  defStyleNum="dsChar"/>
		<itemData name="Comment"  defStyleNum="dsComment"/>
		<itemData name="Symbol"  defStyleNum="dsNormal"/>
		<itemData name="Pattern"  defStyleNum="dsOthers"/>
	</itemDatas>
  </highlighting>
  <general>
    <comments>
      <comment name="singleLine" start="#" />
    </comments>
    <keywords casesensitive="1" />
  </general>
</language>
